{
  "format": "pixelforge-wave",
  "version": 1,
  "name": "portal",
  "width": 38,
  "height": 56,
  "palette": {
    "k": "#211d36",
    "q": "#675081",
    "r": "#a56fb1",
    "s": "#d6a1cf",
    "t": "#fae1c8",
    "u": "#526261",
    "v": "#34434b",
    "g": "#c39e65"
  },
  "anchor": [19, 51],
  "effects": {
    "open": {
      "frames": 40,
      "duration": 60,
      "sources": [
        { "kind": "radial", "at": [18.5, 27], "stretch": [0.8, 1.6], "wavelength": 9, "amplitude": 0.65, "cycles": -2 },
        { "kind": "directional", "at": [18.5, 27], "angle": 0, "wavelength": 12, "amplitude": 0.3, "cycles": 1 },
        { "kind": "directional", "at": [18.5, 27], "angle": 180, "wavelength": 12, "amplitude": 0.3, "cycles": 1 }
      ],
      "mask": { "at": [18.5, 27], "radius": [13, 21], "feather": 0.2 },
      "look": { "colors": ["q", "r", "s"], "thresholds": [0.25, 0.62, 0.94] },
      "underlay": [
        "......................................",
        "......................................",
        "......................................",
        "...............kkkkkkkk...............",
        ".............kkkuuvvvvkkk.............",
        "...........kkuuuuuvvvvvvvkk...........",
        "..........kkuuuuuuvvvvvvvvkk..........",
        ".........kkuuuuuuuvvvvvvvvvkk.........",
        "........kkuuuuukkkkkkkkvvvvvkk........",
        "........kuuuukkkkkkkkkkkkvvvvk........",
        ".......kuuuukkkkkkkkkkkkkkvvvvk.......",
        "......kkuuukkkkkkkkkkkkkkkkvvvkk......",
        "......kuuukkkkkkkkkkkkkkkkkkvvvk......",
        ".....kuuuukkkkkkkkkkkkkkkkkkvvvvk.....",
        ".....kuuukkkkkkkkkkkkkkkkkkkkvvvk.....",
        ".....kuukkkkkkkkkkkkkkkkkkkkkkvvk.....",
        "....kuuukkkkkkkkkkkkkkkkkkkkkkvvvk....",
        "....kuuukkkkkkkkkkkkkkkkkkkkkkvvvk....",
        "....kuukkkkkkkkkkkkkkkkkkkkkkkkvvk....",
        "...kuuukkkkkkkkkkkkkkkkkkkkkkkkvvvk...",
        "...kuuukkkkkkkkkkkkkkkkkkkkkkkkvvvk...",
        "...kuukkkkkkkkkkkkkkkkkkkkkkkkkkvvk...",
        "...kuukkkkkkkkkkkkkkkkkkkkkkkkkkvvk...",
        "...kuukkkkkkkkkkkkkkkkkkkkkkkkkkvvk...",
        "...uuukkkkkkkkkkkkkkkkkkkkkkkkkkvvv...",
        "...uuukkkkkkkkkkkkkkkkkkkkkkkkkkvvv...",
        "..kuuukkkkkkkkkkkkkkkkkkkkkkkkkkvvvk..",
        "..kuuukkkkkkkkkkkkkkkkkkkkkkkkkkvvvk..",
        "..kuuukkkkkkkkkkkkkkkkkkkkkkkkkkvvvk..",
        "...vvvkkkkkkkkkkkkkkkkkkkkkkkkkkvvv...",
        "...vvvkkkkkkkkkkkkkkkkkkkkkkkkkkvvv...",
        "...kvvkkkkkkkkkkkkkkkkkkkkkkkkkkvvk...",
        "...kvvkkkkkkkkkkkkkkkkkkkkkkkkkkvvk...",
        "...kvvkkkkkkkkkkkkkkkkkkkkkkkkkkvvk...",
        "...kvvvkkkkkkkkkkkkkkkkkkkkkkkkvvvk...",
        "...kvvvkkkkkkkkkkkkkkkkkkkkkkkkvvvk...",
        "....kvvkkkkkkkkkkkkkkkkkkkkkkkkvvk....",
        "....kvvvkkkkkkkkkkkkkkkkkkkkkkvvvk....",
        "....kvvvkkkkkkkkkkkkkkkkkkkkkkvvvk....",
        ".....kvvkkkkkkkkkkkkkkkkkkkkkkvvk.....",
        ".....kvvvkkkkkkkkkkkkkkkkkkkkvvvk.....",
        ".....kvvvvkkkkkkkkkkkkkkkkkkvvvvk.....",
        "......kvvvkkkkkkkkkkkkkkkkkkvvvk......",
        "......kkvvvkkkkkkkkkkkkkkkkvvvkk......",
        ".......kvvvvkkkkkkkkkkkkkkvvvvk.......",
        "........kvvvvkkkkkkkkkkkkvvvvk........",
        "........kkvvvvvkkkkkkkkvvvvvkk........",
        ".........kkvvvvvvvvvvvvvvvvkk.........",
        "..........kkvvvvvvvvvvvvvvkk..........",
        "...........kkvvvvvvvvvvvvkk...........",
        "....uuuuuuuuuuuuuuuuuuuuuuuuuuuuuu....",
        "....vvvvvvvvvvvvvvvvvvvvvvvvvvvvvv....",
        "....vvvvvvvvvvvvvvvvvvvvvvvvvvvvvv....",
        "....vvvvvvvvvvvvvvvvvvvvvvvvvvvvvv....",
        "......................................",
        "......................................"
      ],
      "overlay": [
        "......................................",
        "......................................",
        "......................................",
        "......................................",
        ".................tttt.................",
        "................ssrrrr................",
        "..............sss....rrr..............",
        "............ss..........rr............",
        "...........ss............rr...........",
        "..........ss..............rr..........",
        "..........s................r..........",
        ".........s..................r.........",
        "........s....................r........",
        "........s....................r........",
        ".......s......................r.......",
        ".......s......................r.......",
        "......s........................r......",
        "......s........................r......",
        "......s........................r......",
        "......................................",
        ".....s..........................r.....",
        ".....s..........................r.....",
        ".....s..........................r.....",
        ".....s..........................r.....",
        ".....s..........................r.....",
        ".....s..........................r.....",
        ".....s..........................r.....",
        ".....t..........................t.....",
        ".....s..........................r.....",
        ".....s..........................r.....",
        ".....s..........................r.....",
        ".....s..........................r.....",
        ".....s..........................r.....",
        ".....s..........................r.....",
        ".....s..........................r.....",
        "......................................",
        "......s........................r......",
        "......s........................r......",
        "......s........................r......",
        ".......s......................r.......",
        ".......s......................r.......",
        "........s....................r........",
        "........s....................r........",
        ".........s..................r.........",
        "..........s................r..........",
        "..........ss..............rr..........",
        "...........ss............rr...........",
        "............ss..........rr............",
        "..............sss....rrr..............",
        "................ssrrrr................",
        "......................................",
        "...............gggggggg...............",
        "......................................",
        "......................................",
        "......................................",
        "......................................"
      ]
    }
  }
}
