{
  "format": "pixelforge-wave",
  "version": 1,
  "name": "interference",
  "width": 48,
  "height": 30,
  "palette": { "b": "#358f9c", "c": "#66c7bf", "d": "#c6f1d0" },
  "anchor": [24, 15],
  "effects": {
    "resonate": {
      "frames": 40,
      "duration": 60,
      "sources": [
        { "kind": "radial", "at": [17.5, 14.5], "stretch": [1, 0.55], "wavelength": 10, "amplitude": 0.7, "cycles": 2 },
        { "kind": "radial", "at": [29.5, 14.5], "stretch": [1, 0.55], "wavelength": 10, "amplitude": 0.7, "cycles": 2 }
      ],
      "mask": { "at": [23.5, 14.5], "radius": [23, 13], "feather": 0.22 },
      "look": { "colors": ["b", "c", "d"], "thresholds": [0.32, 0.72, 1.06] },
      "overlay": [
        "................................................",
        "................................................",
        "................................................",
        "................................................",
        "................................................",
        "................................................",
        "................................................",
        "................................................",
        "................................................",
        "................................................",
        "................................................",
        "................................................",
        "................................................",
        ".................d...........d..................",
        "................ddd.........ddd.................",
        ".................d...........d..................",
        "................................................",
        "................................................",
        "................................................",
        "................................................",
        "................................................",
        "................................................",
        "................................................",
        "................................................",
        "................................................",
        "................................................",
        "................................................",
        "................................................",
        "................................................",
        "................................................"
      ]
    }
  }
}
